{
  "schema_version": "1.0",
  "mission_id": "11111111-1111-4111-8111-111111111111",
  "correlation_id": "22222222-2222-4222-8222-222222222222",
  "idempotency_key": "demo-documentation-20260907-001",
  "workspace_id": "workspace-demo",
  "customer_id": "customer-demo",
  "project_id": "project-demo-site",
  "actor": {
    "actor_id": "operator-demo",
    "identity_source": "server_authenticated",
    "access_mode": "private",
    "delegation_reference": null
  },
  "origin": "cursor",
  "capability_id": "knowledge.search",
  "capability_version": "1.0",
  "objective": "Retrouver la derniere procedure validee de livraison du site de demonstration et citer sa version.",
  "arguments": {
    "query": "procedure de livraison validee du site de demonstration",
    "project_id": "project-demo-site",
    "max_results": 5
  },
  "status": "ready",
  "created_at": "2026-09-07T09:00:00Z",
  "expires_at": "2026-09-07T09:15:00Z",
  "business_timezone": "Europe/Paris",
  "budget": {
    "currency": "EUR",
    "max_cost_minor": 20,
    "max_duration_seconds": 120,
    "policy_reference": "demo-policy-not-an-authorization"
  },
  "result": null,
  "evidence": [],
  "error": null
}
